{
  "coverage_note": "One qualifying design-level analysis: the BAMA high-dimensional mediation model (formal directed hypothesis, mediation). Boundary items cover the SAIGE GWAS association, the univariate mediation comparison sharing the same design unit, proposed future interventions, and cited external SNP associations.",
  "excluded_boundary_candidates": [
    {
      "boundary_note": "Association screen that generates the SNP exposures for the mediation model. It reports significant associations only, with no named identifying variation or formal directed method, so it is association, not a design-level causal analysis.",
      "candidate_label": "GWAS with SAIGE identifying SNPs significantly associated with SPARE-AD index",
      "evidence_atom_ids": [
        "ea_1dee713f23a56c489c7226f1",
        "ea_d6f6968430765eaaf094aa5c",
        "ea_f8cf72d0e39527e6aae6e657"
      ],
      "first_failed_condition": "no_named_causal_basis",
      "reviewer_candidate_id": "gwas_saige_spare_ad"
    },
    {
      "boundary_note": "Same identifying variation (mediation), same SNP exposures, same UKBB population, and same normalized SNP-to-PA-to-SPARE-AD link as the BAMA analysis, applied as a comparison estimator returning null results. Not a distinct design unit from the qualifying mediation analysis.",
      "candidate_label": "Univariate mediation analysis (R mediation package) of BAMA-detected signals",
      "evidence_atom_ids": [
        "ea_2c017624141beaa278d7309e",
        "ea_e5c3de92bce6f689c606a270",
        "ea_382f16f8ce7c5790eee7b097",
        "ea_c57d1d1cccc7efd68df9f6dd"
      ],
      "first_failed_condition": "not_distinct_design_unit",
      "reviewer_candidate_id": "univariate_mediation_comparison"
    },
    {
      "boundary_note": "External study findings quoted in the discussion to contextualize the three SNPs; not empirical results generated by this report.",
      "candidate_label": "Cited external GWAS associations linking identified SNPs to cognition, white blood cell count, and white matter",
      "evidence_atom_ids": [
        "ea_6132e4087f73b1fbeceb5357",
        "ea_beb1c3b033d4cb13ce8eb32d",
        "ea_e035a1a6b5a46e29213fba0a"
      ],
      "first_failed_condition": "not_current_report",
      "reviewer_candidate_id": "cited_external_snp_associations"
    },
    {
      "boundary_note": "Suggested future intervention design with no current-report empirical result; planned experiment only.",
      "candidate_label": "Proposed future interventional studies enhancing physical activity to reduce AD risk",
      "evidence_atom_ids": [
        "ea_aaac6c738bf2b6cfb6f14339"
      ],
      "first_failed_condition": "no_empirical_result",
      "reviewer_candidate_id": "future_interventional_studies"
    }
  ],
  "qualifying_analyses": [
    {
      "analysis_label": "Bayesian high-dimensional mediation (BAMA) of physical activity patterns between SPARE-AD-associated SNPs and AD-like brain atrophy",
      "biological_system": "UK Biobank cohort of 13,425 participants with imputed genetic data, wrist accelerometry, and structural MRI-derived SPARE-AD",
      "boundary_note": "Named mediation (formal directed hypothesis) integrating genetics, accelerometry, and neuroimaging into one cross-omics directed model; outcome is age-related disease (AD) brain atrophy. Single design unit spanning all 22 SNP exposures under one shared analytic procedure; child SNP/mediator contrasts not split.",
      "causal_basis": "formal_directed_hypothesis",
      "comparator": "Implicit per-allele contrast (effect vs reference allele dosage); comparator wording incomplete in the mediation design",
      "design_family": "mediation",
      "exposure_or_intervention_construct": "22 SNPs significantly associated with SPARE-AD (mostly on AMPD3 gene) used as exposures",
      "identifying_variation_or_assignment": "Formal directed mediation model (BAMA) with assumed directional/temporal ordering SNP exposure to physical activity mediator to SPARE-AD outcome, using Bayesian continuous shrinkage prior and PIP-based active-mediator selection",
      "method_evidence_atom_ids": [
        "ea_297cc1ee1b4d94d237c2a0bf",
        "ea_b3a01628dc8164e5ea9006ee",
        "ea_0b0e4ecf6fd5ddebeb919b31",
        "ea_a1608f2118d6a8a6ba4eebf3",
        "ea_46c62e1862aee2b81192f0ef"
      ],
      "outcome_constructs": [
        "Physical activity patterns (154 accelerometry features) as mediators",
        "SPARE-AD index (AD-like brain atrophy)"
      ],
      "result_evidence_atom_ids": [
        "ea_011d35e236690b094b6cc60e",
        "ea_26e9cff8b109188cae3c2add",
        "ea_4f87ff1997f7d176db299c03",
        "ea_d8baeddd00bb0c1ba721ebe7",
        "ea_1c393b467895fac138080990"
      ],
      "reviewer_candidate_id": "bama_high_dimensional_mediation",
      "validation_evidence_atom_ids": []
    }
  ],
  "report_id": "doi:10.1186/s13040-025-00432-1",
  "reviewer_id": "claude_opus_4_8",
  "source_status": "sufficient"
}
